{"contract":"market-condition-revision","schemaVersion":2,"requestId":"request-synthetic","asOf":"2026-10-17T08:00:00+00:00","data":{"tagId":"condition-synthetic","revisionId":"condition-revision-synthetic","revisionNumber":1,"label":"Human range observation","archived":false,"contentHash":"0bab6f50c2df488b0a3dc3e8f5d4b13d0feca76c121c7f8954afe3338aa3fd49","publicationSequence":2,"knownAtUtc":"2026-10-17T08:00:00+00:00"}}
